<?xml version="1.0" encoding="UTF-8"?>
<dataroot xmlns:od="urn:schemas-microsoft-com:officedata" xmlns:xsi="http://www.w3.org/2001/XMLSchema-instance"  xsi:noNamespaceSchemaLocation="Groups.xsd" generated="2018-10-15T13:28:28">
<Groups>
<GROUP_ID>1</GROUP_ID>
<GROUP>Фундаментальная информатика и информационные технологии</GROUP>
</Groups>
<Groups>
<GROUP_ID>2</GROUP_ID>
<GROUP>Программная инженерия</GROUP>
</Groups>
<Groups>
<GROUP_ID>3</GROUP_ID>
<GROUP>Прикладная математика и информатика</GROUP>
</Groups>
</dataroot>
